{
  "artifact_id": "00000000-0000-4000-8000-000000000006",
  "citation_id": "00000000-0000-4000-8000-000000000007",
  "claim_id": "claim-1",
  "locator": "5.2.1",
  "locator_type": "CLAUSE",
  "schema_version": "1.0.0",
  "source_sha256": "aaaaaaaaaaaaaaaaaaaaaaaaaaaaaaaaaaaaaaaaaaaaaaaaaaaaaaaaaaaaaaaa"
}
